{
  "schema": "cpb-instance-state-v2",
  "state": "upgrading",
  "active_lifecycle_agent": ".github/agents/project-control-plane-upgrade.agent.md",
  "active_upgrade_packet": "control-plane/workbench/upgrades/cp-v0-8-1-planning-admission",
  "cpb_version": "1.0.0-shape-v1",
  "active_lanes": "derived from control-plane/horizons/*/HORIZON_STATE.json plus active TRACKER.json files",
  "last_updated": "2026-09-29",
  "state_vocabulary": {
    "operational": "boundary operations and horizon work proceed per packet-local admission, closure, and tracker authority",
    "ops-work": "exclusive singleton control-plane runtime and governance work",
    "suspended": "no governed commands; the plane itself is under surgery",
    "upgrading": "CPB framework replacement in progress; lanes halted at boundaries"
  },
  "provenance": "Clean seed from CP-V08 0.8-portable.1. Installation details are in INSTALLATION.json. No project state was imported.",
  "notes": [
    {
      "date": "2026-09-25",
      "kind": "selective-upgrade",
      "operations": "restricted",
      "summary": "Selective control-plane repair for the admission-readiness gate mismatch; H000 execution and admission remain halted until the repair is verified."
    },
    {
      "date": "2026-09-25",
      "kind": "upgrade-complete",
      "summary": "UG-001 verified by the horizon-packet fixture suite; normal lifecycle operation restored."
    },
    {
      "date": "2026-09-25",
      "kind": "selective-upgrade",
      "operations": "restricted",
      "summary": "Selective control-plane repair for the admission timing-cleanliness conflict; H000 admission remains halted until UG-002 is verified."
    },
    {
      "date": "2026-09-25",
      "kind": "upgrade-complete",
      "summary": "UG-002 merged to protected main at 301bc89, passed focused regression suites, and restored normal lifecycle operation."
    },
    {
      "date": "2026-09-25",
      "kind": "selective-upgrade",
      "operations": "restricted",
      "summary": "UG-003 assessment and repair planning opened by explicit /control-plane-upgrade invocation. Phase timing open resolves the horizon root, but other session commands retain the instance root. Phase execution is halted pending authorized runtime repair and verification; preserve H000 admission and the failed CP-101 timing evidence. Cutover has not started."
    },
    {
      "date": "2026-09-25",
      "kind": "upgrade-resume-blocked",
      "operations": "restricted",
      "summary": "Explicit /control-plane-upgrade --resume continued UG-003 from local verification and resolved local review finding UG003-R1. Cutover has started; reset remains prohibited. GitHub PR #5 is still OPEN at 9ca88814129d75384b2efe51d710d48fb2ce8fc2 with no merge commit or timestamp. Protected-main integration and governed completion remain pending; instance stays upgrading. Preserve H000 admission and the failed CP-101 session. No merge, phase retry, session recovery, or agent archival was performed."
    },
    {
      "date": "2026-09-25",
      "kind": "upgrade-complete",
      "summary": "Operator explicitly approved returning to operational on repair/UG-003-timing-routing before PR #5 merges, superseding the merge-first completion sequence. UG-003 is locally verified with 23 routing and 2 harvest checks passing and local review finding UG003-R1 resolved. Branch-local upgrade completion is recorded; protected-main integration remains pending. Archive the temporary UG-003 agent and clear its active reference. Preserve H000 admission and failed CP-101 evidence; no phase preparation, execution, or session recovery is authorized by this transition."
    },
    {
      "date": "2026-09-28",
      "kind": "upgrade-entry",
      "invocation_source": "operator-confirmation",
      "upgrade_id": "cp-v0-8-1-planning-admission",
      "packet": "control-plane/workbench/upgrades/cp-v0-8-1-planning-admission",
      "branch": "upgrade/cp-v0.8.1-planning-admission",
      "baseline_sha": "95f3ff1599937dc0231879fba42ca5d325d588c3",
      "summary": "Operator confirmed CP V0.8.1 planning/admission upgrade execution and necessary entry repair. Reconciled entry contracts and instance schema passed 7 static/schema checks, 23 timing-routing checks and 2 harvest checks. New packet and coordinator verified before activation. Steward owns authorized framework implementation; populated-install migration and timing redesign are deferred. Local CP test-state/timing resets are permitted after applicable source preservation checks. No product execution, publication, forge administration, or lifecycle completion is implied. Old upgrade and H000 records remain unchanged."
    },
    {
      "date": "2026-09-29",
      "kind": "operator-directed-horizon-test-reset",
      "summary": "Operator explicitly requested removal of H000 and all existing repository horizon packets before manual validation setup. Verified all 67 external inception-pack hashes, four original source copies, and a byte-exact 40-file horizon snapshot. Removed the sole packet H000-poker-night, including trackers, approvals, ledgers, prompts, sources and packet timing/current pointer. Horizon root now has zero packets; CP-101 through CP-111 no longer resolve. No active planning binding existed. Framework repairs, upgrade packet/pointers, historical evidence and Git refs are preserved. Instance remains upgrading; no manual test setup, admission, execution, commit or push is implied. See workbench/steward-consults/2026-09-29-horizon-data-scrub.md."
    }
  ]
}